{
    "$schema": "https://json-schema.org/draft/2020-12/schema",
    "$id": "https://raw.githubusercontent.com/imperialCHEPI/healthgps/main/schemas/v2/config/models/kevinhall.json",
    "$defs": {
        "weightQuantileGenderEntry": {
            "oneOf": [
                {
                    "$ref": "../../../v1/config/csv_file.json"
                },
                {
                    "type": "object",
                    "propertyNames": {
                        "pattern": "^Quintile[1-9][0-9]*$"
                    },
                    "additionalProperties": {
                        "$ref": "../../../v1/config/csv_file.json"
                    },
                    "minProperties": 1
                }
            ]
        }
    },
    "type": "object",
    "properties": {
        "$schema": {
            "type": "string"
        },
        "ModelName": {
            "const": "KevinHall"
        },
        "Nutrients": {
            "type": "array",
            "items": {
                "type": "object",
                "properties": {
                    "Name": {
                        "type": "string"
                    },
                    "Unit": {
                        "type": "string"
                    },
                    "Range": {
                        "type": "array",
                        "items": {
                            "type": "number",
                            "minimum": 0.0
                        },
                        "minItems": 2,
                        "maxItems": 2
                    },
                    "Energy": {
                        "type": "number",
                        "minimum": 0.0
                    }
                },
                "additionalProperties": false
            },
            "minItems": 1
        },
        "Foods": {
            "type": "array",
            "items": {
                "type": "object",
                "properties": {
                    "Name": {
                        "type": "string"
                    },
                    "Nutrients": {
                        "type": "object",
                        "additionalProperties": {
                            "type": "number"
                        }
                    },
                    "Price": {
                        "anyOf": [
                            {
                                "type": "number"
                            },
                            {
                                "type": "null"
                            }
                        ]
                    },
                    "ExpectedTrend": {
                        "type": "number"
                    },
                    "TrendSteps": {
                        "type": "integer"
                    },
                    "ExpectedIncomeTrend": {
                        "type": "number"
                    },
                    "IncomeTrendSteps": {
                        "type": "integer"
                    },
                    "IncomeDecayFactor": {
                        "type": "number",
                        "description": "Exponential decay factor 'b' for income trend calculation"
                    }
                },
                "additionalProperties": false
            }
        },
        "WeightQuantiles": {
            "type": "object",
            "propertyNames": {
                "enum": [
                    "Male",
                    "Female"
                ]
            },
            "additionalProperties": {
                "$ref": "#/$defs/weightQuantileGenderEntry"
            }
        },
        "EnergyPhysicalActivityQuantiles": {
            "$ref": "../../../v1/config/csv_file.json"
        },
        "HeightStdDev": {
            "type": "object",
            "properties": {
                "Male": {
                    "type": "number"
                },
                "Female": {
                    "type": "number"
                }
            },
            "additionalProperties": false
        },
        "HeightSlope": {
            "type": "object",
            "properties": {
                "Male": {
                    "type": "number"
                },
                "Female": {
                    "type": "number"
                }
            },
            "additionalProperties": false
        },
        "Height": {
            "type": "object",
            "propertyNames": {
                "enum": [
                    "Male",
                    "Female"
                ]
            },
            "additionalProperties": {
                "$ref": "../../../v1/config/csv_file.json"
            }
        }
    },
    "required": [
        "ModelName",
        "Nutrients",
        "Foods",
        "WeightQuantiles",
        "EnergyPhysicalActivityQuantiles"
    ],
    "anyOf": [
        {
            "required": [
                "HeightStdDev",
                "HeightSlope"
            ]
        },
        {
            "required": [
                "Height"
            ]
        }
    ],
    "additionalProperties": false
}
